アップロード結果,アップロード結果を参照する。,Not started,SAKI Portal,派遣先ポータル,SA-COM-009,Upload Result,Xem kết quả upload/import file.,/saki/upload-results,検証結果、成功件数、エラー件数,"Validation result, success count, error count",,,,SA-COM-009-API-01-Upload Result (https://www.notion.so/SA-COM-009-API-01-Upload-Result-36bf02c407dd805bb2accd38f38b4a85?pvs=21)
検証エラー一覧,検証エラー一覧を表示する。,Not started,SAKI Portal,派遣先ポータル,SA-COM-010,Validation Error List,Danh sách validation errors.,/saki/validation-errors,エラー行、対象項目、エラー内容,"Error row, target field, error message",,,,SA-COM-010-API-01-Validation Error List (https://www.notion.so/SA-COM-010-API-01-Validation-Error-List-36bf02c407dd80f4bb96cd4eb0f0ce83?pvs=21)
操作履歴,ユーザー操作履歴を参照する。,Not started,SAKI Portal,派遣先ポータル,SA-COM-011,Audit Log,Audit thao tác user.,/saki/audit-log,操作者、操作種別、対象画面,"Operator, operation type, target screen",,,,SA-COM-011-API-01-Audit Log (https://www.notion.so/SA-COM-011-API-01-Audit-Log-36bf02c407dd809998f9eb113be176e7?pvs=21)
契約一覧,契約一覧を表示する。,Not started,SAKI Portal,派遣先ポータル,SA-CON-001,Contract List,Danh sách contract.,/saki/contracts,契約番号、派遣元会社、契約期間、状態,"Contract No, MOTO company, period, status","Diagram 2 — 派遣照会〜契約成立フロー (https://www.notion.so/Diagram-2-364f02c407dd806a8429dd8ff501068b?pvs=21), 契約承認フロー (https://www.notion.so/362f02c407dd80d9a3fef628f1cf05f6?pvs=21)",,,SA-CON-001-API-01-Contract List (https://www.notion.so/SA-CON-001-API-01-Contract-List-36bf02c407dd80a19f75e910c6041f6d?pvs=21)
契約詳細,契約詳細を表示する。,Not started,SAKI Portal,派遣先ポータル,SA-CON-002,Contract Detail,Xem contract detail.,/saki/contracts/:id,スタッフ情報、請求条件,"Staff info, billing condition","Diagram 2 — 派遣照会〜契約成立フロー (https://www.notion.so/Diagram-2-364f02c407dd806a8429dd8ff501068b?pvs=21), 契約承認フロー (https://www.notion.so/362f02c407dd80d9a3fef628f1cf05f6?pvs=21)",,,
契約承認,契約を承認・却下する。,Not started,SAKI Portal,派遣先ポータル,SA-CON-003,Contract Approval,Approve/reject contract.,/saki/contracts/:id/approve,承認状態、却下理由,"Approval status, reject reason","Diagram 2 — 派遣照会〜契約成立フロー (https://www.notion.so/Diagram-2-364f02c407dd806a8429dd8ff501068b?pvs=21), 契約承認フロー (https://www.notion.so/362f02c407dd80d9a3fef628f1cf05f6?pvs=21)",,,SA-CON-003-API-01-Contract Approval (https://www.notion.so/SA-CON-003-API-01-Contract-Approval-36bf02c407dd801c97c2d4e0fed09712?pvs=21)
未承認契約一覧,未承認契約一覧を表示する。,Not started,SAKI Portal,派遣先ポータル,SA-CON-004,Pending Contract Approval,Danh sách contract chờ approve.,/saki/contracts/pending,未承認契約、提出日時,"Pending contracts, submitted datetime",Diagram 2 — 派遣照会〜契約成立フロー (https://www.notion.so/Diagram-2-364f02c407dd806a8429dd8ff501068b?pvs=21),,,SA-CON-004-API-01-Pending Contract Approval (https://www.notion.so/SA-CON-004-API-01-Pending-Contract-Approval-36bf02c407dd80f6a132fff21cb05264?pvs=21)
契約変更履歴,契約変更履歴を参照する。,Not started,SAKI Portal,派遣先ポータル,SA-CON-005,Contract Revision History,Lịch sử chỉnh sửa contract.,/saki/contracts/history,変更項目、操作者、日時,"Changed field, operator, datetime",Diagram 2 — 派遣照会〜契約成立フロー (https://www.notion.so/Diagram-2-364f02c407dd806a8429dd8ff501068b?pvs=21),,,SA-CON-005-API-01-Contract Revision History (https://www.notion.so/SA-CON-005-API-01-Contract-Revision-History-36bf02c407dd800b8ccafb597bf2e2dc?pvs=21)
契約書DL,契約書PDFをダウンロードする。,Not started,SAKI Portal,派遣先ポータル,SA-CON-006,Contract PDF Download,Download contract PDF.,/saki/contracts/:id/pdf,PDFファイル、生成日時,"PDF file, generated datetime",Diagram 2 — 派遣照会〜契約成立フロー (https://www.notion.so/Diagram-2-364f02c407dd806a8429dd8ff501068b?pvs=21),,,SA-CON-006-API-01-Contract PDF Download (https://www.notion.so/SA-CON-006-API-01-Contract-PDF-Download-36bf02c407dd801fb043e4f290116c17?pvs=21)
契約DL履歴,契約書DL履歴を参照する。,Not started,SAKI Portal,派遣先ポータル,SA-CON-007,Contract Download History,Lịch sử download contract.,/saki/contracts/download-history,DLファイル、操作者,"Downloaded file, operator",Diagram 2 — 派遣照会〜契約成立フロー (https://www.notion.so/Diagram-2-364f02c407dd806a8429dd8ff501068b?pvs=21),,,SA-CON-007-API-01-Contract Download History (https://www.notion.so/SA-CON-007-API-01-Contract-Download-History-36bf02c407dd808cb876cb1e00c094a6?pvs=21)
契約延長承認,契約延長申請を承認する。,Not started,SAKI Portal,派遣先ポータル,SA-CON-008,Contract Extension Approval,Approve extension request.,/saki/contracts/:id/extension,延長期間、新請求単価,"Extension period, new billing amount",,,,SA-CON-008-API-01-Contract Extension Approval (https://www.notion.so/SA-CON-008-API-01-Contract-Extension-Approval-36bf02c407dd8044aeeccd1a11401af0?pvs=21)
契約終了確認,契約終了内容を確認する。,Not started,SAKI Portal,派遣先ポータル,SA-CON-009,Contract End Confirmation,Confirm contract end.,/saki/contracts/:id/end,終了日、終了理由,"End date, end reason",,,,SA-CON-009-API-01-Contract End Confirmation (https://www.notion.so/SA-CON-009-API-01-Contract-End-Confirmation-36bf02c407dd806ba6e9e7a61ffa4d85?pvs=21)
派遣照会一覧,派遣照会一覧を表示する。,Not started,SAKI Portal,派遣先ポータル,SA-REQ-001,Staffing  Request List,Danh sách staffing requests.,/saki/requests,派遣照会番号、状態、作成日、回答期限,"Request No, status, created date, deadline","Diagram 2 — 派遣照会〜契約成立フロー (https://www.notion.so/Diagram-2-364f02c407dd806a8429dd8ff501068b?pvs=21), 派遣照会作成フロー (https://www.notion.so/362f02c407dd805a994bc76255349f48?pvs=21), 見積比較フロー (https://www.notion.so/362f02c407dd8047b453d78dc8f5d44d?pvs=21)",,,SA-REQ-001-API-01-Staffing Request List (https://www.notion.so/SA-REQ-001-API-01-Staffing-Request-List-36bf02c407dd806d811dd9fb68437671?pvs=21)
派遣照会詳細,派遣照会詳細を表示する。,Not started,SAKI Portal,派遣先ポータル,SA-REQ-002,Staffing Request Detail,Xem chi tiết staffing request.,/saki/requests/:id,募集条件、就業場所、契約期間,"Requirement, workplace, contract period","Diagram 2 — 派遣照会〜契約成立フロー (https://www.notion.so/Diagram-2-364f02c407dd806a8429dd8ff501068b?pvs=21), 派遣照会,見積回答フロー (https://www.notion.so/362f02c407dd809d9476e61607dfe5e3?pvs=21), 見積比較フロー (https://www.notion.so/362f02c407dd8047b453d78dc8f5d44d?pvs=21)",,,"SA-REQ-002-API-01-Staffing Request Detail (https://www.notion.so/SA-REQ-002-API-01-Staffing-Request-Detail-36bf02c407dd80809c0be1d9042b479a?pvs=21), SA-REQ-005-API-01-Staffing Cancel Request (https://www.notion.so/SA-REQ-005-API-01-Staffing-Cancel-Request-36bf02c407dd802f85dfe67f648f21ea?pvs=21), SA-REQ-006-API-01-Estimate List (https://www.notion.so/SA-REQ-006-API-01-Estimate-List-36bf02c407dd8087aab2e101b9b3a901?pvs=21), SA-REQ-007-API-01-Estimate Detail (https://www.notion.so/SA-REQ-007-API-01-Estimate-Detail-36bf02c407dd80139629d65121ce5a2a?pvs=21), SA-REQ-008-API-01-Estimate Compare (https://www.notion.so/SA-REQ-008-API-01-Estimate-Compare-36bf02c407dd80608fcbd44d7daf248f?pvs=21), SA-REQ-009-API-01-Estimate Export (https://www.notion.so/SA-REQ-009-API-01-Estimate-Export-36bf02c407dd80c08967e863ca84b23c?pvs=21), SA-REQ-010-API-01-Staffing Response List (https://www.notion.so/SA-REQ-010-API-01-Staffing-Response-List-36bf02c407dd805fb3b5d572d6553362?pvs=21), SA-REQ-011-API-01-Response Detail (https://www.notion.so/SA-REQ-011-API-01-Response-Detail-36bf02c407dd809795d5c89c351fbed8?pvs=21)"
派遣照会作成,新規派遣照会を作成する。,Not started,SAKI Portal,派遣先ポータル,SA-REQ-003,Staffing Create Request,Tạo staffing request mới.,/saki/requests/create,募集条件、必要人数、契約期間,"Requirement, headcount, contract period","Diagram 2 — 派遣照会〜契約成立フロー (https://www.notion.so/Diagram-2-364f02c407dd806a8429dd8ff501068b?pvs=21), 派遣照会作成フロー (https://www.notion.so/362f02c407dd805a994bc76255349f48?pvs=21)",,,SA-REQ-003-API-01-Staffing Create Request (https://www.notion.so/SA-REQ-003-API-01-Staffing-Create-Request-36bf02c407dd80cbbdc4fabab0308b95?pvs=21)
派遣照会修正,派遣照会を修正する。,Not started,SAKI Portal,派遣先ポータル,SA-REQ-004,Staffing Edit Request,Chỉnh sửa request trước khi finalized.,/saki/requests/:id/edit,更新項目、更新日時,"Updated fields, modified datetime","Diagram 2 — 派遣照会〜契約成立フロー (https://www.notion.so/Diagram-2-364f02c407dd806a8429dd8ff501068b?pvs=21), 派遣照会作成フロー (https://www.notion.so/362f02c407dd805a994bc76255349f48?pvs=21), 派遣照会,見積回答フロー (https://www.notion.so/362f02c407dd809d9476e61607dfe5e3?pvs=21)",,,SA-REQ-004-API-01-Staffing Edit Request (https://www.notion.so/SA-REQ-004-API-01-Staffing-Edit-Request-36bf02c407dd80e39459cf271c517e2c?pvs=21)
派遣照会取消,派遣照会を取消する。,Not started,SAKI Portal,派遣先ポータル,SA-REQ-005,Staffing Cancel Request,Hủy staffing request.,/saki/requests/:id/cancel,取消理由、取消日時,"Cancel reason, canceled datetime","Diagram 2 — 派遣照会〜契約成立フロー (https://www.notion.so/Diagram-2-364f02c407dd806a8429dd8ff501068b?pvs=21), 契約作成フロー (https://www.notion.so/362f02c407dd80f3a10cfe645cd590f4?pvs=21)",,,SA-REQ-005-API-01-Staffing Cancel Request (https://www.notion.so/SA-REQ-005-API-01-Staffing-Cancel-Request-36bf02c407dd802f85dfe67f648f21ea?pvs=21)
見積一覧,派遣元からの見積一覧を表示する。,Not started,SAKI Portal,派遣先ポータル,SA-REQ-006,Estimate List,Danh sách estimate từ MOTO.,/saki/estimates,派遣元会社、見積金額、状態,"MOTO company, estimate amount, status","Diagram 2 — 派遣照会〜契約成立フロー (https://www.notion.so/Diagram-2-364f02c407dd806a8429dd8ff501068b?pvs=21), 見積比較フロー (https://www.notion.so/362f02c407dd8047b453d78dc8f5d44d?pvs=21)",,,SA-REQ-006-API-01-Estimate List (https://www.notion.so/SA-REQ-006-API-01-Estimate-List-36bf02c407dd8087aab2e101b9b3a901?pvs=21)
見積詳細,見積詳細を表示する。,Not started,SAKI Portal,派遣先ポータル,SA-REQ-007,Estimate Detail,Chi tiết estimate.,/saki/estimates/:id,請求条件、見積条件,"Billing condition, estimate condition","Diagram 2 — 派遣照会〜契約成立フロー (https://www.notion.so/Diagram-2-364f02c407dd806a8429dd8ff501068b?pvs=21), 見積比較フロー (https://www.notion.so/362f02c407dd8047b453d78dc8f5d44d?pvs=21), 契約作成フロー (https://www.notion.so/362f02c407dd80f3a10cfe645cd590f4?pvs=21)",,,SA-REQ-007-API-01-Estimate Detail (https://www.notion.so/SA-REQ-007-API-01-Estimate-Detail-36bf02c407dd80139629d65121ce5a2a?pvs=21)
見積比較,複数派遣元の見積を比較する。,Not started,SAKI Portal,派遣先ポータル,SA-REQ-008,Estimate Compare,So sánh estimate giữa nhiều MOTO.,/saki/estimates/compare,単価、条件、回答速度,"Unit price, condition, response speed","Diagram 2 — 派遣照会〜契約成立フロー (https://www.notion.so/Diagram-2-364f02c407dd806a8429dd8ff501068b?pvs=21), 見積比較フロー (https://www.notion.so/362f02c407dd8047b453d78dc8f5d44d?pvs=21)",,,SA-REQ-008-API-01-Estimate Compare (https://www.notion.so/SA-REQ-008-API-01-Estimate-Compare-36bf02c407dd80608fcbd44d7daf248f?pvs=21)
見積DL,見積データを出力する。,Not started,SAKI Portal,派遣先ポータル,SA-REQ-009,Estimate Export,Export estimate CSV/PDF.,/saki/estimates/export,出力条件、生成ファイル,"Export condition, generated file","Diagram 2 — 派遣照会〜契約成立フロー (https://www.notion.so/Diagram-2-364f02c407dd806a8429dd8ff501068b?pvs=21), 見積比較フロー (https://www.notion.so/362f02c407dd8047b453d78dc8f5d44d?pvs=21)",,,SA-REQ-009-API-01-Estimate Export (https://www.notion.so/SA-REQ-009-API-01-Estimate-Export-36bf02c407dd80c08967e863ca84b23c?pvs=21)
派遣照会回答一覧,派遣照会回答一覧を表示する。,Not started,SAKI Portal,派遣先ポータル,SA-REQ-010,Staffing Response List,Danh sách response từ MOTO.,/saki/responses,回答会社、提案人数、請求単価,"Response company, proposed count, billing amount","Diagram 2 — 派遣照会〜契約成立フロー (https://www.notion.so/Diagram-2-364f02c407dd806a8429dd8ff501068b?pvs=21), 見積比較フロー (https://www.notion.so/362f02c407dd8047b453d78dc8f5d44d?pvs=21)",,,SA-REQ-010-API-01-Staffing Response List (https://www.notion.so/SA-REQ-010-API-01-Staffing-Response-List-36bf02c407dd805fb3b5d572d6553362?pvs=21)
派遣照会回答詳細,派遣照会回答詳細を表示する。,Not started,SAKI Portal,派遣先ポータル,SA-REQ-011,Response Detail,Xem response detail.,/saki/responses/:id,回答内容、コメント、回答日時,"Response detail, comment, response datetime","Diagram 2 — 派遣照会〜契約成立フロー (https://www.notion.so/Diagram-2-364f02c407dd806a8429dd8ff501068b?pvs=21), 見積比較フロー (https://www.notion.so/362f02c407dd8047b453d78dc8f5d44d?pvs=21), 契約作成フロー (https://www.notion.so/362f02c407dd80f3a10cfe645cd590f4?pvs=21)",,,SA-REQ-011-API-01-Response Detail (https://www.notion.so/SA-REQ-011-API-01-Response-Detail-36bf02c407dd809795d5c89c351fbed8?pvs=21)
未回答一覧,未回答一覧を表示する。,Not started,SAKI Portal,派遣先ポータル,SA-REQ-013,Pending Response List,Danh sách request chưa có response.,/saki/pending-responses,派遣照会番号、期限、未回答日数,"Request No, deadline, pending days","Diagram 2 — 派遣照会〜契約成立フロー (https://www.notion.so/Diagram-2-364f02c407dd806a8429dd8ff501068b?pvs=21), 見積比較フロー (https://www.notion.so/362f02c407dd8047b453d78dc8f5d44d?pvs=21)",,,SA-REQ-013-API-01-Pending Response List (https://www.notion.so/SA-REQ-013-API-01-Pending-Response-List-36bf02c407dd80699d68e3a32d42805d?pvs=21)
企業マスタ,企業情報を管理する。,Not started,SAKI Portal,派遣先ポータル,SA-SET-001,Company Master,Quản lý company info.,/saki/settings/company,会社名、住所、税番号,"Company name, address, tax code",テナントマスタ管理フロー (https://www.notion.so/362f02c407dd8079998cccb206e8bbdd?pvs=21),,,
部署マスタ,部署情報を管理する。,Not started,SAKI Portal,派遣先ポータル,SA-SET-002,Department Master,Quản lý department.,/saki/settings/departments,部署名、責任者,"Department name, manager",テナントマスタ管理フロー (https://www.notion.so/362f02c407dd8079998cccb206e8bbdd?pvs=21),,,
就業場所一覧,就業場所一覧を表示する。,Not started,SAKI Portal,派遣先ポータル,SA-SET-003,Workplace List,Danh sách workplace.,/saki/settings/workplaces,就業場所名、住所、利用状態,"Workplace name, address, active status",テナントマスタ管理フロー (https://www.notion.so/362f02c407dd8079998cccb206e8bbdd?pvs=21),,,
権限マスタ,権限ロールを管理する。,Not started,SAKI Portal,派遣先ポータル,SA-SET-004,Role Master,Quản lý RBAC role.,/saki/settings/roles,権限名、権限数,"Role name, permission count","テナントマスタ管理フロー (https://www.notion.so/362f02c407dd8079998cccb206e8bbdd?pvs=21), テナント権限管理フロー (https://www.notion.so/362f02c407dd809f9b10fd60ec3d5513?pvs=21)",,,
就業場所詳細,就業場所詳細を表示する。,Not started,SAKI Portal,派遣先ポータル,SA-SET-004,Workplace Detail,Chi tiết workplace.,/saki/settings/workplaces/:id,就業場所詳細、連絡先,"Workplace detail, contact info",テナントマスタ管理フロー (https://www.notion.so/362f02c407dd8079998cccb206e8bbdd?pvs=21),,,
ユーザーマスタ,派遣先ユーザーを管理する。,Not started,SAKI Portal,派遣先ポータル,SA-SET-005,User Master,Quản lý SAKI users.,/saki/settings/users,ユーザー名、権限、状態,"User name, role, status","テナントマスタ管理フロー (https://www.notion.so/362f02c407dd8079998cccb206e8bbdd?pvs=21), テナント権限管理フロー (https://www.notion.so/362f02c407dd809f9b10fd60ec3d5513?pvs=21)",,,
メール通知設定,メール通知設定を管理する。,Not started,SAKI Portal,派遣先ポータル,SA-SET-007,Mail Notification Setting,Thiết lập mail notification.,/saki/settings/mail-notifications,通知種別、送信先グループ,"Notification type, receiver group",テナントマスタ管理フロー (https://www.notion.so/362f02c407dd8079998cccb206e8bbdd?pvs=21),,,
取引派遣元詳細,取引を行う派遣元企業の詳細情報を表示する,Not started,SAKI Portal,派遣先ポータル,SCR-AGY-001,Chi tiết công ty phái cử đối tác,,,,,,,,
取引派遣元追加,取引を行う派遣元企業を追加する,Not started,SAKI Portal,派遣先ポータル,SCR-AGY-002,Thêm công ty phái cử đối tác,,,,,,,,
取引派遣元一覧,取引を行う派遣元企業の一覧およびステータスを表示する,Not started,SAKI Portal,派遣先ポータル,SCR-AGY-003,Danh sách công ty phái cử đối tác,,,,,,,,
承認ルート管理,派遣照会や契約を承認するための承認ルートを管理する,Not started,SAKI Portal,派遣先ポータル,SCR-APR-001,Quản lý luồng phê duyệt,,,,,,,,
代理申請（勤怠申請×複数）,特定日（単日）の複数人の勤怠申請を行う,Not started,MOTO Portal,派遣元ポータル,SCR-ATT-021,Đăng ký chấm công thay cho nhiều nhân viên,,,,,,,,
待遇情報提供・事業所抵触日一覧,待遇情報提供・事業所抵触日通知の一覧を表示する,Not started,SAKI Portal,派遣先ポータル,SCR-ATT-022,Phê duyệt chốt công,,,,,,,,
本パスワード設定画面,初回ログイン時に初期パスワードと変更後のパスワードを入力を行う,Not started,MOTO Portal,派遣元ポータル,SCR-AUT-003,Thiết lập mật khẩu lần đầu,,,,,,,,
パスワード再発行手続き画面,パスワードの忘失時に再発行を行うための画面,Not started,SAKI Portal,派遣先ポータル,SCR-AUT-004,Cấp lại mật khẩu,,,,,,,,
パスワード再発行手続き画面,パスワードの忘失時に再発行を行うための画面,Not started,MOTO Portal,派遣元ポータル,SCR-AUT-004,Cấp lại mật khẩu,,,,,,,,
待遇情報提供・事業所抵触日通知内容設定,"待遇情報の提供・事業所抵触日の通知設定を行う。
派遣会社もしくは契約を選択して通知する。",Not started,SAKI Portal,派遣先ポータル,SCR-BNF-001,Thiết lập nội dung cung cấp thông tin chế độ đãi ngộ / thông báo ngày chạm giới hạn sử dụng lao động phái cử,,,,,,,,
提供・通知内容入力,待遇情報の提供・事業所抵触日の通知内容を入力する,Not started,SAKI Portal,派遣先ポータル,SCR-BNF-002,Nhập nội dung cung cấp / thông báo,,,,,,,,
作成中待遇情報提供・事業所抵触日一覧,"作成中の待遇情報提供・事業所抵触日通知の一覧を表示する
修正・削除・非表示・修正済通知の通知が可能",Not started,SAKI Portal,派遣先ポータル,SCR-BNF-003,Danh sách thông báo chế độ đãi ngộ / ngày chạm giới hạn đang soạn thảo,,,,,,,,
作成中待遇情報提供・事業所抵触日修正,作成中の待遇情報提供・事業所抵触日通知を修正する,Not started,SAKI Portal,派遣先ポータル,SCR-BNF-004,Chỉnh sửa thông báo chế độ đãi ngộ / ngày chạm giới hạn đang soạn thảo,,,,,,,,
勤怠締め承認,勤怠締め承認を行う,Not started,SAKI Portal,派遣先ポータル,SCR-BNF-005,Danh sách thông báo chế độ đãi ngộ / ngày chạm giới hạn,,,,,,,,
請求書提出取り消し画面,提出した請求書の取り消しを行う,Not started,MOTO Portal,派遣元ポータル,SCR-INV-014,Hủy nộp hóa đơn,,,,,,,,
未請求契約一覧,請求書が発行できていない契約を表示する,Not started,MOTO Portal,派遣元ポータル,SCR-INV-015,Danh sách hợp đồng chưa xuất hóa đơn,,,,,,,,
請求書修正・調整画面,"請求書の情報を修正・調整する画面
※勤怠データや立替金データとはことなる明細レコードを追加などする可能性がある（トラブル対応や特殊な取り決めへの対応）",Not started,MOTO Portal,派遣元ポータル,SCR-INV-016,Điều chỉnh / chỉnh sửa hóa đơn,,,,,,,,
作成中派遣照会一覧,作成中の派遣照会一覧を表示する,Not started,SAKI Portal,派遣先ポータル,SCR-SHO-001,Danh sách yêu cầu phái cử đang soạn thảo,,,,,,,,
作成中派遣照会詳細,作成中の依頼内容を表示する,Not started,SAKI Portal,派遣先ポータル,SCR-SHO-002,Chi tiết yêu cầu phái cử đang soạn thảo,,,,,,,,
作成中派遣照会削除,作成中の依頼の削除確認をする。,Not started,SAKI Portal,派遣先ポータル,SCR-SHO-003,Xác nhận xóa yêu cầu phái cử đang soạn thảo,,,,,,,,
派遣照会検索,入力した条件で派遣照会を検索する。,Not started,SAKI Portal,派遣先ポータル,SCR-SHO-004,Tìm kiếm yêu cầu phái cử,,,,,,,,
派遣照会検索結果,"検索した派遣照会一覧を表示する。
（依頼の複製が可能）",Not started,SAKI Portal,派遣先ポータル,SCR-SHO-005,Kết quả tìm kiếm yêu cầu phái cử,,,,,,,,
非表示案件復帰,処理済み（画面非表示）の依頼を見積依頼・派遣照会状況画面に再表示する,Not started,SAKI Portal,派遣先ポータル,SCR-SHO-006,Khôi phục yêu cầu đã ẩn,,,,,,,,
派遣照会作成 - 起票者プロファイル確認,新規派遣照会作成時の起票者プロファイルを確認する。電話番号の変更が可能。,Not started,SAKI Portal,派遣先ポータル,SCR-SHO-007,Tạo yêu cầu phái cử - Xác nhận thông tin người tạo,,,,,,,,
派遣照会作成 - 依頼条件入力,新規派遣照会作成時の依頼条件を入力する。,Not started,SAKI Portal,派遣先ポータル,SCR-SHO-008,Tạo yêu cầu phái cử - Nhập điều kiện yêu cầu,,,,,,,,
派遣照会作成 - 派遣会社指定,新規派遣照会作成時の派遣会社を入力する。,Not started,SAKI Portal,派遣先ポータル,SCR-SHO-009,Tạo yêu cầu phái cử - Chỉ định công ty phái cử,,,,,,,,
派遣照会作成 - 承認者選択,新規派遣照会作成時の承認者を入力する。,Not started,SAKI Portal,派遣先ポータル,SCR-SHO-010,Tạo yêu cầu phái cử - Chọn người phê duyệt,,,,,,,,
派遣照会作成 - 依頼内容確認,新規派遣照会作成時の入力内容を確認する。,Not started,SAKI Portal,派遣先ポータル,SCR-SHO-011,Tạo yêu cầu phái cử - Xác nhận nội dung yêu cầu,,,,,,,,
派遣照会作成 - 派遣照会完了,新規派遣照会作成時の完了を表示する。,Not started,SAKI Portal,派遣先ポータル,SCR-SHO-012,Tạo yêu cầu phái cử - Hoàn tất,,,,,,,,
スタッフ詳細画面,"スタッフの詳細情報を表示する
",Not started,MOTO Portal,派遣元ポータル,SCR-STF-008,Chi tiết nhân viên,,,,,,,,
勤怠一覧,スタッフ勤怠一覧を表示する。,Not started,Staff Mobile APP,スタッフアプリ,ST-ATT-001,Attendance List,Danh sách attendance của staff.,/staff/attendance,勤務日、勤怠状態、承認状態,"Work date, attendance status, approval status",,,,ST-ATT-001-API-01-Attendance List (https://www.notion.so/ST-ATT-001-API-01-Attendance-List-36bf02c407dd8000bcd7e246e2d4feba?pvs=21)
勤怠詳細,勤怠詳細を表示する。,Not started,Staff Mobile APP,スタッフアプリ,ST-ATT-002,Attendance Detail,Xem chi tiết attendance.,/staff/attendance/:id,出退勤時間、休憩時間、残業時間,"Check-in/out, break time, overtime",,,,ST-ATT-002-API-01-Attendance Detail (https://www.notion.so/ST-ATT-002-API-01-Attendance-Detail-36bf02c407dd8080ba20eaed257cccaa?pvs=21)
勤怠入力,日次勤怠を入力する。,Not started,Staff Mobile APP,スタッフアプリ,ST-ATT-003,Attendance Input,Nhập attendance hàng ngày.,/staff/attendance/input,開始時間、終了時間、休憩時間、備考,"Start/end time, break time, remarks",,,,ST-ATT-003-API-01-Create Attendance (https://www.notion.so/ST-ATT-003-API-01-Create-Attendance-36bf02c407dd80d6ac1bf985ad854c09?pvs=21)
勤怠修正,承認前勤怠を修正する。,Not started,Staff Mobile APP,スタッフアプリ,ST-ATT-004,Attendance Edit,Chỉnh sửa attendance trước approval.,/staff/attendance/:id/edit,修正済勤怠項目,Modified attendance fields,,,,ST-ATT-004-API-01-Update Attendance (https://www.notion.so/ST-ATT-004-API-01-Update-Attendance-36bf02c407dd80a4a11bd68cf1b21cc0?pvs=21)
